{
  "schema": "bahtepoto-research-v1",
  "agent": "astra-renault",
  "brands": [
    "Dacia"
  ],
  "models": [
    "Lodgy",
    "Sandero"
  ],
  "researchedAt": "2026-10-18",
  "sources": [
    {
      "id": "hella-sandero-ignition",
      "title": "Sandero: kontak anahtarının marş konumunda takılması",
      "url": "https://www.hella.com/techworld/uk/bi/pdf/Dacia-Sandero-ignition-switch-stuck/Dacia-Sandero-ignition-switch-stuck.pdf",
      "kind": "technical-publication",
      "publisher": "HELLA",
      "reviewed": true,
      "reviewMethod": "Bağlantı açıldı; ilgili yazı/bülten ve kapsam metni okundu."
    },
    {
      "id": "sandero-easyr-owner-2020",
      "title": "2020 Sandero 0.9 Easy-R titreme ve tekleme bildirimi",
      "url": "https://www.sikayetvar.com/dacia/2020-dacia-sandero-stepway-09-turbo-easy-r-titreme-ve-tekleme-sorunu-1",
      "kind": "user-report",
      "publisher": "Şikayetvar",
      "reviewed": true,
      "reviewMethod": "Bağlantı açıldı; ilgili yazı/bülten ve kapsam metni okundu.",
      "publishedAt": "2024-08-19"
    },
    {
      "id": "sandero-easyr-owner-2019",
      "title": "Sandero Easy-R kalkış ve geri viteste titreme bildirimi",
      "url": "https://www.sikayetvar.com/dacia/dacia-sanderoda-kronik-titreme-sorunu-ve-magduriyet",
      "kind": "user-report",
      "publisher": "Şikayetvar",
      "reviewed": true,
      "reviewMethod": "Bağlantı açıldı; ilgili yazı/bülten ve kapsam metni okundu.",
      "publishedAt": "2025-09-28",
      "note": "Çözüldü etiketi yanında sonraki yorumda tekrarlama bildirimi de var; kalıcı çözüm kabul edilmedi."
    },
    {
      "id": "lodgy-light-stalk-2019",
      "title": "Lodgy: sağ sinyal kullanıldığında farların sönmesi",
      "url": "https://communaute.dacia.fr/forum/DACIA/DACIA-LODGY/LES-FEUX-DE-ROUTE-S-ETEIGNENT-LORSQUE-J-ACTIVE-LE-CLIGNOTANT-DROIT/4006787/263244",
      "kind": "user-report",
      "publisher": "Dacia kullanıcı topluluğu",
      "reviewed": true,
      "reviewMethod": "Bağlantı açıldı; ilgili yazı/bülten ve kapsam metni okundu.",
      "publishedAt": "2019-12-28",
      "note": "Üretici alan adında barınan kullanıcı tartışmasıdır; resmî teknik bülten değildir."
    },
    {
      "id": "lodgy-light-stalk-2025",
      "title": "Lodgy: kısa far arızası ve kumanda kolu deneyimleri",
      "url": "https://communaute.dacia.fr/forum/DACIA/LODGY/PANNE-FEUX-DE-CROISEMENT/5472252/263244",
      "kind": "user-report",
      "publisher": "Dacia kullanıcı topluluğu",
      "reviewed": true,
      "reviewMethod": "Bağlantı açıldı; ilgili yazı/bülten ve kapsam metni okundu.",
      "publishedAt": "2025-08-28",
      "note": "İlk mesaj ve devamındaki kullanıcı deneyimleri okundu. Araç yaşından üretim yılı hesaplanmadı."
    }
  ],
  "issues": [
    {
      "id": "astra-renault-sandero-ignition-stuck",
      "title": "Kontak anahtarının marş konumunda takılması",
      "summary": "Bazı Sandero araçlarda kontak anahtarı marş konumundan geri dönemeyebiliyor. Marş dişlisi ayrılmadığında ses ve marş motorunda hasar oluşabiliyor.",
      "category": "electrical",
      "frequency": "unknown",
      "frequencyRationale": "Teknik kaynak arıza mekanizmasını açıklıyor; Türkiye araç parkındaki görülme sıklığını ölçen veri sunmuyor.",
      "vehicles": [
        {
          "brand": "Dacia",
          "model": "Sandero",
          "years": {
            "from": 2013,
            "to": 2021
          }
        }
      ],
      "sourceIds": [
        "hella-sandero-ignition"
      ],
      "uncertainties": "Kaynak VIN aralığı UU15SDKJ558926581–UU1HSDM9G60030836. 2013–2021 geniş tarih aralığı tek başına yeterli değildir; VIN ve kontak tipi doğrulanmalı. Nesil belirtilmediği için tahmin edilmedi. Duster kaydıyla benzer belirti, ayrı model/parça kapsamı vardır. Türkiye araçları için aynı parça/üretim kapsamı ayrıca doğrulanmalı; kaynak bir Türkiye geri çağırması değildir."
    },
    {
      "id": "astra-renault-sandero-easyr-judder",
      "title": "Easy-R’de kalkış ve geri viteste titreme",
      "summary": "Bazı Sandero 0.9 Easy-R sahipleri kalkışta ve geri viteste belirgin titreme bildiriyor. Kavrama veya aktarma sistemi kontrolü gerekiyor; bütün otomatik şanzımanlara genellenmemeli.",
      "category": "clutch",
      "frequency": "medium",
      "frequencyRationale": "İki farklı Türkiye araç sahibi aynı Easy-R kombinasyonunda benzer titreme bildiriyor. Yaygınlık oranı ve bütün vakaların ortak nedeni bilinmiyor.",
      "vehicles": [
        {
          "brand": "Dacia",
          "model": "Sandero",
          "years": {
            "from": 2019,
            "to": 2020
          },
          "engines": [
            {
              "name": "0.9 TCe"
            }
          ],
          "transmission": {
            "type": "automated-manual",
            "name": "Easy-R"
          }
        }
      ],
      "sourceIds": [
        "sandero-easyr-owner-2020",
        "sandero-easyr-owner-2019"
      ],
      "uncertainties": "Kaynaklar 2019 ve 2020 araçlarını anlatıyor; aynı sorun için iki bağımsız bildirim var. Volan/kavrama kök nedeni bağımsız teşhis raporuyla doğrulanmadı. Nesil kodu ve parça sürümü ayrıca eşleştirilmeli. Easy-R robotize manuel sistemdir; EDC ve CVT kapsam dışı."
    },
    {
      "id": "astra-renault-lodgy-light-stalk-intermittent",
      "title": "Far kumandasında aralıklı kesilme",
      "summary": "Bazı Lodgy sahipleri sinyal kolunu kullanırken farların sönmesini veya kısa farların çalışmamasını bildiriyor. Kumanda kolundaki temas sorunu olası neden olarak aktarılıyor.",
      "category": "electrical",
      "frequency": "medium",
      "frequencyRationale": "İki ayrı tartışmada birden fazla kullanıcı benzer far/kol sorununu kendi aracında bildiriyor. Teknik inceleme ve araç parkına göre sıklık ölçümü yok.",
      "vehicles": [
        {
          "brand": "Dacia",
          "model": "Lodgy"
        }
      ],
      "sourceIds": [
        "lodgy-light-stalk-2019",
        "lodgy-light-stalk-2025"
      ],
      "uncertainties": "Fransa kullanıcı topluluğunda tekrar eden bildirimlerdir; Türkiye araçlarında aynı kumanda parçası doğrulanmadı. Motor, kesin model yılı ve nesil verilmediğinden otomatik tüm araç eşleştirmesi yapılmamalı. Kullanıcıların tasarım kusuru iddiası kesin kabul edilmedi."
    }
  ]
}
